,Response,Share of women
0,Physical/sexual attraction,52%
1,"Your partner's lack of attention, affection or tenderness",47%
2,Desire to take advantage of the opportunity that arises with someone you like,37%
3,The lack of sexual satisfaction with your partner,36%
4,Desire to rediscover the magic of the first moments in a relationship,35%
5,Feelings,31%
6,Your need to prove that you can still be liked/ to boost your ego,30%
7,Your taste for adventure/the forbidden,22%
8,Revenge on your partner's infidelity,18%
