,Response,Share of respondents
0,"Minimize any potential stress (e.g. reconfirm booking, offer free transfers)",36%
1,"Provide additional travel suggestions (e.g. restaurant choices, attractions, itineraries)",35%
2,Introduce guests to the hotel (e.g. its location and facilities),31%
3,"Provide local information on the destination (e.g. weather, history of the area)",30%
4,Begin building a relationship with guests (e.g. introduce hotel/front desk staff),26%
5,Promote add on services to guests (e.g. transfers),18%
6,Actively contact guests to build excitement about their upcoming vacation,13%
