,Response,Share of respondents
0,Want to know what's in the food I'm eating,87%
1,Concerned that not enough research has been done on the long-term health and environmental impacts of genetically modified food,58%
2,Safety concerns,55%
3,Lack of transparency in the government's approval process for genetically modified food,47%
4,Concerned that genetically modified food is not natural,46%
5,Concerned that genetically modified foods give large companies too much control over the food chain,46%
6,Concerned about the environmental effects of genetically modified food,45%
7,Ethical concerns about genetically modifying plants and animals,30%
8,Other,2%
