,impact,Share or respondents
0,Businesses affected by the pandemic,95%
1,Medium-sized companies that plan to reduce employment,80%
2,Small companies that plan to reduce employment,71%
3,Entrepreneurs who plan to reduce employment,69%
4,Entrepreneurs who will close the company if they do not receive support from the state,68%
5,Micro-entrepreneurs who are suffering the very serious consequences of the pandemic,63%
6,Entrepreneurs who are suffering the very serious consequences of the pandemic,55%
7,Entrepreneurs who plan to lay off 20-50% of their employees in the next two weeks,54%
8,Entrepreneurs who will start making workers redundant within 3 weeks if they do not receive State aid,47%
