,Response,Percentage of respondents
0,Bought something online or through a mobile app and picked it up in store,45%
1,Bought sth online or through a mobile app and picked up curbside (did not enter store),37%
2,Bought sth online or through a mobile app & returned it to the store for refund or exchange,35%
3,Bought sth in store & cashier had access to my online account info,39%
4,Used coupons or discounts from my mobile phone or app to make a purchase in store,63%
5,Used my mobile phone while in store to compare prices of items,61%
6,Used my mobile phone while in store to compare reviews of items,62%
7,Used a mobile phone to check store inventory,56%
