,Response,Share of respondents
0,My country had imposed a closure of all non-essential businesses,63%
1,I/my family was/were practicing social distancing and wanted to minimize our time outside of the home,62%
2,I/my family was/were under quarantine and could not leave our home,52%
3,I wanted to avoid the queues in the supermarket and other shops,51%
4,I can purchase more items online than in a physical shop,18%
5,The items I wanted to purchase were only found online or on e-commerce sites,18%
6,Others,2%
