,Response,Share of respondents
0,Personalized support and information on degree progress,92%
1,Personalized dashboards that give you real-time feedback about your progress,89%
2,Suggestions for how to improve performance,88%
3,Personalized quizzes or practice questions,88%
4,Real-time feedback from your instructor about your performance or progress,88%
5,Guidance about courses you might consider taking,87%
6,Alerts if it appears your progress in a course is declining,86%
7,Suggestions about new or different academic resources,84%
8,Feedback about performance compared with that of other students,82%
