,television networks,Unnamed: 1
0,CTV coverage including CTV News' live special & prime-time recap (in million unique viewers),7.8
1,CTV News' live special coverage (in million unique viewers),5.4
2,"CTV, CTV News Channel & CP24 live coverage (in million average viewers)",1.1
3,"CTV live coverage (in 1,000 average viewers)",939.0
4,"CTV News' prime-time recap special coverage (in 1,000 average viewers)",606.0
5,"CBC TV & News Network live coverage (in 1,000 average viewers)",997.0
6,"Global News live coverage (in 1,000 average viewers)",371.0
